{"$schema":"https://json-schema.org/draft/2020-12/schema","title":"Pasol Pattern Pack 1.0.0","type":"object","additionalProperties":false,"required":["schema_version","pack_id","pack_version","engine","engine_version_requirement","sources"],"properties":{"schema_version":{"const":"1.0.0"},"pack_id":{"type":"string","minLength":1,"maxLength":4096},"pack_version":{"type":"string","minLength":1,"maxLength":4096},"engine":{"const":"yara-x"},"engine_version_requirement":{"type":"string","minLength":1,"maxLength":128},"created_at":{"type":"string","maxLength":64},"limits_profile":{"type":"string","maxLength":128},"metadata_policy":{"type":"string","maxLength":128},"sources":{"type":"array","minItems":1,"maxItems":256,"items":{"type":"object","additionalProperties":false,"required":["namespace","path","sha256"],"properties":{"namespace":{"type":"string","minLength":1,"maxLength":256},"path":{"type":"string","minLength":1,"maxLength":4096},"sha256":{"type":"string","pattern":"^[0-9a-f]{64}$"}}}}}}
